{
  "$schema": "https://json-schema.org/draft/2020-12/schema",
  "$id": "urn:tinydraw:esp32s3-calibration-receipt:v1",
  "title": "TinyDraw ESP32-S3 hardware calibration receipt",
  "type": "object",
  "additionalProperties": false,
  "required": [
    "schemaVersion",
    "receiptKind",
    "captureMode",
    "capturedAt",
    "git",
    "toolchain",
    "sdkconfig",
    "boot",
    "counter",
    "measurement"
  ],
  "properties": {
    "schemaVersion": { "const": 1 },
    "receiptKind": { "const": "esp32s3-hardware-calibration" },
    "captureMode": { "enum": ["hardware", "schema-fixture"] },
    "capturedAt": {
      "type": "string",
      "pattern": "^\\d{4}-\\d{2}-\\d{2}T\\d{2}:\\d{2}:\\d{2}(?:\\.\\d{1,3})?Z$"
    },
    "git": { "$ref": "#/$defs/git" },
    "toolchain": { "$ref": "#/$defs/toolchain" },
    "sdkconfig": { "$ref": "#/$defs/sdkconfig" },
    "boot": { "$ref": "#/$defs/boot" },
    "counter": { "$ref": "#/$defs/counter" },
    "measurement": {
      "oneOf": [
        { "$ref": "#/$defs/ccountKernel" },
        { "$ref": "#/$defs/ccountPanel" }
      ]
    }
  },
  "$defs": {
    "positiveInteger": {
      "type": "integer",
      "minimum": 1,
      "maximum": 9007199254740991
    },
    "nonNegativeInteger": {
      "type": "integer",
      "minimum": 0,
      "maximum": 9007199254740991
    },
    "sha256": {
      "type": "string",
      "pattern": "^[0-9a-f]{64}$"
    },
    "git": {
      "type": "object",
      "additionalProperties": false,
      "required": ["repository", "commit", "dirty"],
      "properties": {
        "repository": { "type": "string", "minLength": 1 },
        "commit": {
          "type": "string",
          "pattern": "^(?:[0-9a-f]{40}|[0-9a-f]{64})$"
        },
        "dirty": { "type": "boolean" }
      }
    },
    "toolchain": {
      "type": "object",
      "additionalProperties": false,
      "required": ["target", "espIdfVersion", "compiler", "compilerVersion"],
      "properties": {
        "target": { "const": "esp32s3" },
        "espIdfVersion": { "type": "string", "minLength": 1 },
        "compiler": { "type": "string", "minLength": 1 },
        "compilerVersion": { "type": "string", "minLength": 1 }
      }
    },
    "sdkconfig": {
      "type": "object",
      "additionalProperties": false,
      "required": [
        "path",
        "sha256",
        "cpuHz",
        "psramMode",
        "psramBusHz",
        "flashMode",
        "flashBusHz"
      ],
      "properties": {
        "path": { "type": "string", "minLength": 1 },
        "sha256": { "$ref": "#/$defs/sha256" },
        "cpuHz": { "$ref": "#/$defs/positiveInteger" },
        "psramMode": { "type": "string", "minLength": 1 },
        "psramBusHz": {
          "oneOf": [{ "$ref": "#/$defs/positiveInteger" }, { "type": "null" }]
        },
        "flashMode": { "type": "string", "minLength": 1 },
        "flashBusHz": {
          "oneOf": [{ "$ref": "#/$defs/positiveInteger" }, { "type": "null" }]
        }
      }
    },
    "boot": {
      "type": "object",
      "additionalProperties": false,
      "required": [
        "bootId",
        "bootLogSha256",
        "resetReason",
        "chipModel",
        "chipRevision",
        "cpuCores",
        "psramBytes",
        "flashBytes"
      ],
      "properties": {
        "bootId": { "type": "string", "minLength": 1 },
        "bootLogSha256": { "$ref": "#/$defs/sha256" },
        "resetReason": { "type": "string", "minLength": 1 },
        "chipModel": { "const": "ESP32-S3" },
        "chipRevision": { "$ref": "#/$defs/nonNegativeInteger" },
        "cpuCores": { "const": 2 },
        "psramBytes": { "$ref": "#/$defs/nonNegativeInteger" },
        "flashBytes": { "$ref": "#/$defs/positiveInteger" }
      }
    },
    "counter": {
      "type": "object",
      "additionalProperties": false,
      "required": ["source", "bits", "hz", "core"],
      "properties": {
        "source": { "const": "xtensa-ccount" },
        "bits": { "const": 32 },
        "hz": { "$ref": "#/$defs/positiveInteger" },
        "core": { "enum": [0, 1] }
      }
    },
    "ccountSample": {
      "type": "object",
      "additionalProperties": false,
      "required": ["ordinal", "startCore", "endCore", "startCcount", "endCcount", "cycles"],
      "properties": {
        "ordinal": { "$ref": "#/$defs/nonNegativeInteger" },
        "startCore": { "enum": [0, 1] },
        "endCore": { "enum": [0, 1] },
        "startCcount": { "type": "integer", "minimum": 0, "maximum": 4294967295 },
        "endCcount": { "type": "integer", "minimum": 0, "maximum": 4294967295 },
        "cycles": { "type": "integer", "minimum": 1, "maximum": 4294967295 },
        "cacheCounters": { "$ref": "#/$defs/cacheCounters" }
      }
    },
    "cacheCounters": {
      "type": "object",
      "additionalProperties": false,
      "required": ["ibus", "dbus"],
      "properties": {
        "ibus": {
          "type": "object",
          "additionalProperties": false,
          "required": ["accesses", "misses"],
          "properties": {
            "accesses": { "type": "integer", "minimum": 0, "maximum": 4294967295 },
            "misses": { "type": "integer", "minimum": 0, "maximum": 4294967295 }
          }
        },
        "dbus": {
          "type": "object",
          "additionalProperties": false,
          "required": ["accesses", "flashMisses", "psramMisses"],
          "properties": {
            "accesses": { "type": "integer", "minimum": 0, "maximum": 4294967295 },
            "flashMisses": { "type": "integer", "minimum": 0, "maximum": 4294967295 },
            "psramMisses": { "type": "integer", "minimum": 0, "maximum": 4294967295 }
          }
        }
      }
    },
    "samples": {
      "type": "array",
      "minItems": 1,
      "items": { "$ref": "#/$defs/ccountSample" },
      "allOf": [
        {
          "if": { "contains": { "required": ["cacheCounters"] } },
          "then": { "items": { "required": ["cacheCounters"] } }
        }
      ]
    },
    "ccountKernel": {
      "type": "object",
      "additionalProperties": false,
      "required": [
        "kind",
        "kernel",
        "memoryPath",
        "bytesPerIteration",
        "iterationsPerSample",
        "warmupIterations",
        "samples"
      ],
      "properties": {
        "kind": { "const": "ccount-kernel" },
        "kernel": { "type": "string", "minLength": 1 },
        "memoryPath": {
          "enum": [
            "internal-to-internal",
            "psram-to-internal",
            "internal-to-psram",
            "psram-to-psram",
            "flash-to-internal",
            "other"
          ]
        },
        "bytesPerIteration": { "$ref": "#/$defs/nonNegativeInteger" },
        "iterationsPerSample": { "$ref": "#/$defs/positiveInteger" },
        "warmupIterations": { "$ref": "#/$defs/nonNegativeInteger" },
        "samples": { "$ref": "#/$defs/samples" }
      }
    },
    "ccountPanel": {
      "type": "object",
      "additionalProperties": false,
      "required": [
        "kind",
        "operation",
        "width",
        "height",
        "bitsPerPixel",
        "payloadBytes",
        "stripRows",
        "transactionsPerSample",
        "warmupFrames",
        "samples"
      ],
      "properties": {
        "kind": { "const": "ccount-panel" },
        "operation": { "type": "string", "minLength": 1 },
        "width": { "$ref": "#/$defs/positiveInteger" },
        "height": { "$ref": "#/$defs/positiveInteger" },
        "bitsPerPixel": { "$ref": "#/$defs/positiveInteger" },
        "payloadBytes": { "$ref": "#/$defs/positiveInteger" },
        "stripRows": { "$ref": "#/$defs/positiveInteger" },
        "transactionsPerSample": { "$ref": "#/$defs/positiveInteger" },
        "warmupFrames": { "$ref": "#/$defs/nonNegativeInteger" },
        "samples": { "$ref": "#/$defs/samples" }
      }
    }
  }
}
